"conversation_id_str","created_at","favorite_count","full_text","id_str","image_url","in_reply_to_screen_name","lang","location","quote_count","reply_count","retweet_count","tweet_url","user_id_str","username"
"1845637009978835188","Mon Oct 14 01:25:28 +0000 2024","0","Ubah hobi traveling jadi karier yang menjanjikan! ️ Temukan 5 jurusan studi yang cocok untuk para pecinta petualangan di artikel ini. Mulai wujudkan impianmu sekarang! #Traveling #Karier #Pendidikan Simak penjelasannya melalui artikel berikut: https://t.co/Wzz03MpZAT","1845637009978835188","","","in","","0","0","0","https://x.com/apaladiapa/status/1845637009978835188","1467508634997248007","apaladiapa"
"1845636716109136203","Mon Oct 14 01:24:18 +0000 2024","0","Bahas Penerapan Pilar ESG INFEST 2024 Berikan Dua Sudut Pandang Berbeda Selengkapnya: https://t.co/aYHfwV8pS9 #ITBnews #webinar #Ekonomi #transportasi #Multidisiplin #pendidikan #TransformasiITB","1845636716109136203","","","in","Bandung - Jatinangor - Cirebon","0","0","0","https://x.com/itbofficial/status/1845636716109136203","22878447","itbofficial"
"1845635544015048974","Mon Oct 14 01:19:38 +0000 2024","0","Dari kutipan Ki Hajar Dewantara ini kita diajarkan untuk selalu bersyukur dan mau belajar dari setiap perjalanan hidup baik dan buruknya untuk membangun masa depan yang lebih baik. Salam Kristoforus #kristoforus #kutipan #kihajardewantara #pendidikan #sekolahkatolik #PPDB https://t.co/ORgmuxld8n","1845635544015048974","https://pbs.twimg.com/media/GZ0DEE-a4AAqLep.jpg","","in","","0","0","0","https://x.com/schkristoforus/status/1845635544015048974","1825801913654456322","schkristoforus"
"1845603561276858776","Sun Oct 13 23:12:34 +0000 2024","0"," Butiran: https://t.co/juruFa6b5j #kongsirezeki #sahamakhirat #pendidikan #asnaf #ratanakiri #kemboja #MISI7 BANTU KAMI SEBARKAN...","1845603564741353801","","VMisi7","in","Shah Alam, Selangor","0","0","0","https://x.com/VMisi7/status/1845603564741353801","4793401045","VMisi7"
"1845426398040854659","Sun Oct 13 11:28:34 +0000 2024","0","Berikut adalah jadwal materi SpeciaLearn pada 14-20 Oktober 2024. #specialearn #specialearneducation #specialeducation #bimbinganbelajar #bimbel #pendidikan #disabilitas #cacat #sekolah #privat https://t.co/4gorNycNkt","1845426398040854659","https://pbs.twimg.com/media/GZxEXSXaAAIvq19.jpg","","in","Jakarta Timur","0","0","0","https://x.com/specialearn/status/1845426398040854659","1835703503886671872","specialearn"
"1845424977933369811","Sun Oct 13 11:22:55 +0000 2024","0","Mulai Besok akan ada Orientasi Jenis Disabilitas #specialearn #specialearneducation #specialeducation #bimbinganbelajar #bimbel #pendidikan #disabilitas #cacat #sekolah #privat https://t.co/c3nOC2pSkr","1845424977933369811","https://pbs.twimg.com/media/GZxEOY4aAAIU9jo.jpg","","in","Jakarta Timur","0","0","0","https://x.com/specialearn/status/1845424977933369811","1835703503886671872","specialearn"
"1845283335053975708","Sun Oct 13 02:00:05 +0000 2024","0","New Post: Lahirkan 851 Alumni Pemali Boarding School PT Inalum Datangi PT Timah https://t.co/jQLA69Gq84 #csr #pemaliboardingschool #ptinalum #pttimah #pendidikan","1845283335053975708","","","in","Sungai Liat, Indonesia","0","0","0","https://x.com/intrikdotid/status/1845283335053975708","1382918965366714371","intrikdotid"
"1845281713888362514","Sun Oct 13 01:53:38 +0000 2024","0","PTAR tidak hanya fokus pada kegiatan eksplorasi dan produksi emas melainkan juga berkomitmen meningkatkan kesejahteraan masyarakat sekitar melalui berbagai program sosial #ptar #agincourtresources #pendidikan #ppm #penghargaansubroto #petrominer https://t.co/BOzDk62LAJ","1845281713888362514","","","in","Indonesia","0","0","0","https://x.com/petrominer_com/status/1845281713888362514","830820932314730496","petrominer_com"
"1845241068503302432","Sat Oct 12 23:12:08 +0000 2024","3","SMKN 11 Garut Pentas Seni Gondang di Mapay Lembur Cisewu Kab. Garut - https://t.co/IM0ePurkJr - - https://t.co/6VzSG4EYKS - https://t.co/KLGfnRAHa8 - https://t.co/OBtulB0qWp - - #pendidikan #learn #smkn11garut #garut #education #edtech #edchat #edu #elearning https://t.co/hpX7Npie4H","1845241068503302432","https://pbs.twimg.com/media/GZuc4uibkAAyzER.jpg","","in","Indonesia","0","0","2","https://x.com/muchamadekisa/status/1845241068503302432","713145425348276224","muchamadekisa"
"1845240880908861576","Sat Oct 12 23:11:23 +0000 2024","3","SMKN 11 Garut Pentas Seni Gondang di Mapay Lembur Cisewu Kab. Garut - https://t.co/IM0ePurkJr - - https://t.co/6VzSG4EYKS - https://t.co/KLGfnRAHa8 - https://t.co/OBtulB0qWp - - #pendidikan #seni #smkn11garut #garut #education #edtech #edchat #edu #elearning https://t.co/WITvcZeunP","1845240880908861576","https://pbs.twimg.com/media/GZucmM7aYAAUdOK.jpg","","in","Indonesia","0","0","2","https://x.com/muchamadekisa/status/1845240880908861576","713145425348276224","muchamadekisa"
"1845228406516089136","Sat Oct 12 22:21:49 +0000 2024","0","Pengalaman sukses pendidikan inklusi. Pesan inspiratif dari sekolah inklusi. #specialearn #specialearneducation #specialeducation #bimbinganbelajar #bimbel #pendidikan #sekolah #pendidikaninklusi #suksesinklusi https://t.co/hgkiJUUhf2","1845228406516089136","https://pbs.twimg.com/ext_tw_video_thumb/1845226359779622914/pu/img/yxszm8GfcdjuMQ6g.jpg","","in","Jakarta Timur","0","0","0","https://x.com/specialearn/status/1845228406516089136","1835703503886671872","specialearn"
"1845166093813547182","Sat Oct 12 18:14:12 +0000 2024","0","Istri Mengaku Lajang hingga Dilamar Orang #hukumislam #agamaislam #ilmuagama #fypシ゚ #viraltwitter #fyptwitte #fyptwitterviral #pendidikan https://t.co/TdjcW02FEe","1845166093813547182","https://pbs.twimg.com/media/GZtXwE5agAAe5xk.png","","in","Aceh","0","0","0","https://x.com/madrasahaceh/status/1845166093813547182","1844416995925819392","madrasahaceh"
"1844670569398362499","Fri Oct 11 09:25:10 +0000 2024","0","Saksikan #KickAndyShow Kompas Kehidupan Minggu (13/10/2024) pukul 21.05 WIB hanya di #MetroTV. #kickandygoestocampus #kickandy #kisahinspiratif #pendidikan https://t.co/vBMkkCJ1wo","1844670569398362499","https://pbs.twimg.com/media/GZmWGe_awAARBZo.jpg","","in","","0","0","0","https://x.com/Metro_TV/status/1844670569398362499","57261519","Metro_TV"
"1844670268398256303","Fri Oct 11 09:23:58 +0000 2024","3","Simposium dalam Rangkaian IMD 2024 di ITB: Microbes in Our Lives Selengkapnya: https://t.co/D0jRgg7nxY #ITBnews #Simposium #Microbes #transportasi #Multidisiplin #pendidikan #TransformasiITB","1844670268398256303","","","in","Bandung - Jatinangor - Cirebon","0","0","0","https://x.com/itbofficial/status/1844670268398256303","22878447","itbofficial"
"1844665001535324578","Fri Oct 11 09:03:03 +0000 2024","1","Tau ga sih pada usia 0-5 tahun adalah masa golden age seorang anak. Semua perkembangan dan pertumbuhan sangat pesat. Bermain sambil belajar adalah cara menyenangkan bagi anak untuk pertumbuhan dan perkembangan otak anak ＼(^^)／ #goldenage #pendidikan #Trending https://t.co/am3UuA4rir","1844665001535324578","https://pbs.twimg.com/media/GZmRCl6aEAAGaEi.jpg","","in","","0","0","0","https://x.com/pebriiya_/status/1844665001535324578","1600438523600912384","pebriiya_"
"1844661384702734486","Fri Oct 11 08:48:40 +0000 2024","1","Komitmen ITB Hidupkan Stasiun Penelitian di Desa Matotonan Mentawai sebagai Pusat Belajar Masyarakat Selengkapnya: https://t.co/bPz4fC5qyE #ITBnews #PengabdianMasyarakat #infrastruktur #transportasi #Multidisiplin #pendidikan #TransformasiITB","1844661384702734486","","","in","Bandung - Jatinangor - Cirebon","0","0","0","https://x.com/itbofficial/status/1844661384702734486","22878447","itbofficial"
"1844659126766641335","Fri Oct 11 08:39:42 +0000 2024","0","Crisnanalina jangan bimbang lagi tentang duit ya! Fokus sahaja pada pengajian di UMS. https://t.co/scDbxaoADI #sinarbestari #pendidikan #UMS #KPT","1844659126766641335","","","in","","0","0","0","https://x.com/sinarbestarimy/status/1844659126766641335","4711228398","sinarbestarimy"
"1844658936861057400","Fri Oct 11 08:38:57 +0000 2024","0","Tahun depan adik-adik akan bersekolah pada hari Isnin tau bukan lagi Ahad. Jangan tertukar! https://t.co/SXwHQj0j6C #sinarbestari #pendidikan #Johor #KPM","1844658936861057400","","","in","","0","0","0","https://x.com/sinarbestarimy/status/1844658936861057400","4711228398","sinarbestarimy"
"1844649765952209225","Fri Oct 11 08:02:30 +0000 2024","0","Lumrah kebanyakan adik-beradik. Kredit: grondesaurous #sinarbestari #pendidikan #ipt #kemasukankolej #adikberadik #mengusik https://t.co/uZ7KWVmr9z","1844649765952209225","https://pbs.twimg.com/ext_tw_video_thumb/1844648610274881536/pu/img/XYcD6aymTjxtXtbZ.jpg","","in","","0","0","0","https://x.com/sinarbestarimy/status/1844649765952209225","4711228398","sinarbestarimy"
"1844646509004062850","Fri Oct 11 07:49:34 +0000 2024","0","9 pelajar terima tajaan program biasiswa pendidikan Malaysia Airports https://t.co/6ZB1MbnneN #Negara #biasiswa #MalaysiaAirports #pelajar #pendidikan","1844646509004062850","","","in","Malaysia","0","0","0","https://x.com/kosmo_online/status/1844646509004062850","822514562","kosmo_online"
"1844643845830525417","Fri Oct 11 07:38:59 +0000 2024","0","UMKM Jawa Barat Berpeluang Tembus Pasar Global melalui Coaching Clinic SBM ITB dan https://t.co/VXHcLdH6lT Selengkapnya: https://t.co/v7PSycmTKm #ITBnews #CoachingClinic #UMKM #Multidisiplin #pendidikan #TransformasiITB","1844643845830525417","","","in","Bandung - Jatinangor - Cirebon","0","0","0","https://x.com/itbofficial/status/1844643845830525417","22878447","itbofficial"
"1844639368805482770","Fri Oct 11 07:21:11 +0000 2024","0","Cuplikan kegiatan Kristoforian Public Speaking Traingin (KPST) yang diadakan SMA Santo Kristoforian dengan pembicara dari Univ. Bina Nusantara. #publicspeaking #sekolahkristoforus #belajar #komunikasi #kurikulummerdeka #komunikasi #sekolah #murid #pendidikan #bicara #speaker https://t.co/NZ69sZ5Zqy","1844639368805482770","https://pbs.twimg.com/ext_tw_video_thumb/1844638644600238080/pu/img/a7KtsYH5sfKcdHlk.jpg","","in","","0","0","0","https://x.com/schkristoforus/status/1844639368805482770","1825801913654456322","schkristoforus"
"1844633769392869662","Fri Oct 11 06:58:56 +0000 2024","0","Kedatangan 3 Dosen Tamu: SITH ITB Perkuat Jaringan Internasional Melalui WCU SITH Selengkapnya: https://t.co/zqmssQEmy8 #ITBnews #WCU #Sharingsession #Multidisiplin #pendidikan #TransformasiITB","1844633769392869662","","","in","Bandung - Jatinangor - Cirebon","0","0","0","https://x.com/itbofficial/status/1844633769392869662","22878447","itbofficial"
"1844625534954897556","Fri Oct 11 06:26:14 +0000 2024","0",". ⬇️ selengkapnya baca di sini ⬇️ https://t.co/8PNg0IyJzh . . #asuransi #pendidikan #tipsmemilihasuransi #finance #hematId #bandingkanhematnya","1844625539925164165","","eDaunInspirasi","in","Indonesia","0","1","0","https://x.com/eDaunInspirasi/status/1844625539925164165","2963621384","eDaunInspirasi"
"1844612559200248080","Fri Oct 11 05:34:40 +0000 2024","0","Kebakaran PuskesmasCiAsem Subang satu ruangan habis di Lalap si Jago Merah 7-10-24 #indonesia #viral #mobil #polisi #berita #fyp #karawang #subang #purwakarta #jakarta #bandung #news #bus #sekolah #pendidikan #wanita #muslimah #muslim #quote #driver #kebakaran #puskesmas https://t.co/R5Bg8MC1PJ","1844612559200248080","https://pbs.twimg.com/ext_tw_video_thumb/1844612420406505472/pu/img/d7O4lmntnZhrgPrQ.jpg","","in","Indonesia","0","1","1","https://x.com/MediainID/status/1844612559200248080","1709840210329276416","MediainID"
"1844602044914741429","Fri Oct 11 04:52:53 +0000 2024","0"," Kita mahu apabila tamat pengajian nanti pelajar ini menjadi dambaan majikan dan muncul sebagai tenaga kerja yang hebat berintegriti serta mempunyai nilai hebat. - Dr Mohammad Shatar https://t.co/KK69Axmtmp #sinarbestari #pendidikan #mqa #ipt #kpt","1844602044914741429","","","in","","0","0","0","https://x.com/sinarbestarimy/status/1844602044914741429","4711228398","sinarbestarimy"
"1844596762729906420","Fri Oct 11 04:31:53 +0000 2024","0","Mahasiswa Teknik Geofisika ITB Juara 2 di Paleoscan Competition Tampil Gemilang di PIT HAGI 2024 Selengkapnya: https://t.co/iyatbh3avk #ITBnews #PrestasiITB #Geofisika #Multidisiplin #pendidikan #TransformasiITB #ITBsolid #kampusmerdeka","1844596762729906420","","","in","Bandung - Jatinangor - Cirebon","0","0","0","https://x.com/itbofficial/status/1844596762729906420","22878447","itbofficial"
"1844589945790284085","Fri Oct 11 04:04:48 +0000 2024","5","ITB Mencurahkan Air Siap Minum untuk Distrik Misool Selengkapnya: https://t.co/yWvDbLaygP #ITBnews #PengabdianMasyarakat #airminum #Multidisiplin #pendidikan #TransformasiITB","1844589945790284085","","","in","Bandung - Jatinangor - Cirebon","0","0","0","https://x.com/itbofficial/status/1844589945790284085","22878447","itbofficial"
"1844586204928651338","Fri Oct 11 03:49:56 +0000 2024","0","Penerima pinjaman Perbadanan Tabung Pendidikan Tinggi Nasional (PTPTN) digesa agar melunaskan hutang bagi menjamin kelangsungan dana pendidikan untuk generasi akan datang. https://t.co/sPikwCJ27L #ptptn #ngakorming #hutang #pendidikan #mediatelus","1844586204928651338","","","in","","0","0","0","https://x.com/Media_telus/status/1844586204928651338","1828340505610199042","Media_telus"
"1844584962395340828","Fri Oct 11 03:45:00 +0000 2024","0","Ilmu teknik memiliki berbagai cabang salah satunya Teknik Kimia. Berikut mata kuliah pilihan Universitas hingga prospek kerja jurusan Teknik Kimia. #TeknikKimia #Pendidikan #MedcomId #MudaMemberiArti https://t.co/CKbBJ9J8u4","1844584962395340828","","","in","Jakarta Capital Region, Indone","0","0","0","https://x.com/medcom_id/status/1844584962395340828","902837643024539651","medcom_id"
"1844582867357270429","Fri Oct 11 03:36:40 +0000 2024","0","Macam mana kaki boleh tersepit dik? Nasib boleh keluarkan. Lepas ni hati-hati tau. Kredit: bomba.s2 Kredit muzik: Fearless Thorr Soundstripe #sinarbestari #pendidikan #bomba #pelajar #tingkatandua #kakitersepit #PenutupLongkang #abangbomba #trendingvideo #viralvideoシ https://t.co/UddG67aGZK","1844582867357270429","https://pbs.twimg.com/ext_tw_video_thumb/1844582537118760960/pu/img/N26jW4j6FQz7kDZV.jpg","","in","","0","0","0","https://x.com/sinarbestarimy/status/1844582867357270429","4711228398","sinarbestarimy"
"1844581920694468828","Fri Oct 11 03:32:55 +0000 2024","1","Kami percaya bahwa pendidikan adalah jalan menuju perubahan yang lebih baik. #hanowene #pendidikan #sekolah #buku #perpustakaankampung #perpustakaan #tamanbaca https://t.co/vIq5v5GYMs","1844581920694468828","https://pbs.twimg.com/media/GZlFeGMaAAAkWqK.jpg","","in","Papua, Indonesia","0","0","0","https://x.com/HanoWene/status/1844581920694468828","1034509681438253056","HanoWene"
"1844580311210004699","Fri Oct 11 03:26:31 +0000 2024","0","Program PT Timah tingkatkan kualitas SDM melalui Pemali Boarding School! Sejak 2000 program beasiswa ini telah meluluskan 851 alumni. Kini PT Inalum menjadikan program ini sebagai model. #Pendidikan #CSR #Pertambangan #update #news #seketika https://t.co/UXutzbysUG","1844580311210004699","","","in","Jakarta","0","0","0","https://x.com/seketikanet/status/1844580311210004699","1696426676065038336","seketikanet"
"1844576200867578121","Fri Oct 11 03:10:11 +0000 2024","3","Benarkah tekanan belajar di sekolah Cina seperti SMPC terlalu berat hinggakan boleh buat anda yang melaluinya menangis dan tertekan? #pendidikan #malaysia #themerdekatimes https://t.co/7PETcGNiED","1844576200867578121","https://pbs.twimg.com/media/GZlARlRaAAImPeV.jpg","","in","Kuala Lumpur City","0","1","0","https://x.com/TheMerdekaTimes/status/1844576200867578121","1539830140770758657","TheMerdekaTimes"
"1844575418776682818","Fri Oct 11 03:07:05 +0000 2024","10","Pengabdian Dosen Oseanografi ITB Kembangkan Apartemen Kepiting Bertenaga Surya dan Rumah Teripang untuk Tingkatkan Perekonomian Nelayan Raja Ampat Selengkapnya: https://t.co/30ANhQTq0F #ITBnews #PengabdianMasyarakat #Oseanografi #Multidisiplin #pendidikan #TransformasiITB","1844575418776682818","","","in","Bandung - Jatinangor - Cirebon","2","0","1","https://x.com/itbofficial/status/1844575418776682818","22878447","itbofficial"
"1844573648121680222","Fri Oct 11 03:00:02 +0000 2024","0","Adik-adik serap langkah tarian hanya dari video TikTok dengan sangat cepat ibarat span serap air. Kredit: @chegu.man.sk.tebr #sinarbestari #pendidikan #sekolahrendah #tarian #deadpool #byebyebye #fyp https://t.co/NKE9IZYGLs","1844573648121680222","https://pbs.twimg.com/ext_tw_video_thumb/1844562572672131072/pu/img/nhcyWmzTRdt_cPIs.jpg","","in","","0","0","0","https://x.com/sinarbestarimy/status/1844573648121680222","4711228398","sinarbestarimy"
"1844564114057925100","Fri Oct 11 02:22:09 +0000 2024","1","Bersama 81 orang adik-adik yang ceria dan bertenaga dari Sekolah Kebangsaan Bukit Jawa 2 Paser Puteh Kelantan. #sinarbestari #pendidikan #kpm #sekolahrendah #lawatan #karangkraf #kelantan https://t.co/9VnO38i37m","1844564114057925100","https://pbs.twimg.com/media/GZk1R_lbEAA3ET8.jpg","","in","","0","0","0","https://x.com/sinarbestarimy/status/1844564114057925100","4711228398","sinarbestarimy"
"1844555729975509467","Fri Oct 11 01:48:50 +0000 2024","3","ITB Raih 2 Penghargaan Bergengsi di Anugerah Media Humas 2024 Selengkapnya: https://t.co/wHYqqeu7Zp #ITBnews #PrestasiITB #AnugerahMediaHumas #Multidisiplin #pendidikan #TransformasiITB #ITBsolid #kampusmerdeka","1844555729975509467","","","in","Bandung - Jatinangor - Cirebon","1","0","0","https://x.com/itbofficial/status/1844555729975509467","22878447","itbofficial"
"1844517269101269210","Thu Oct 10 23:16:01 +0000 2024","0","Implementasi pendidikan inklusi di sekolah. Tips dan strategi untuk menciptakan kelas yang inklusif. #specialearn #specialearneducation #specialeducation #bimbinganbelajar #bimbel #pendidikan #sekolah #pendidikaninklusi #sekolahinklusif https://t.co/2ZlRYLAug9","1844517269101269210","https://pbs.twimg.com/ext_tw_video_thumb/1844515454343315506/pu/img/UVIw-0_6s9XDH1aH.jpg","","in","Jakarta Timur","0","0","0","https://x.com/specialearn/status/1844517269101269210","1835703503886671872","specialearn"
"1844513246079803724","Thu Oct 10 23:00:01 +0000 2024","1","Fabel kanggo Dewasa Fabel iki kena pengaruh Pendidikan dhasar bocah. ️Para wong tuwa mangga priksa ️nalika nuduhake marang bocah-bocah. Apa sing nggawe dosa lan dadi ala . https://t.co/Wieu3D9ABq . #fabel #dongeng #cerpen #Pendidikan #bukutwt","1844513246079803724","","","in","","0","0","0","https://x.com/HuhitoOfficial/status/1844513246079803724","1451469615012335616","HuhitoOfficial"
"1844347296676471168","Thu Oct 10 12:00:41 +0000 2024","0","Semoga sistem pendidikan di Indonesia tidak bobrok lagi tidak membodohi pihak manapun menyetarakan semuanya tanpa memandang sebelah sini Kota sebelah sana Desa. #indonesia #pendidikan","1844347318931423287","","quinnskylar_","in","","0","0","0","https://x.com/quinnskylar_/status/1844347318931423287","1844340018980192256","quinnskylar_"
"1844347151779860496","Thu Oct 10 12:00:01 +0000 2024","0","'NAMA GRADUAN TERPANJANG DALAM SEJARAH' lancar dan tepat sebutan oleh pembaca nama. Kredit: yongmarina_ #sinarbestari #pendidikan #graduasi #shahalam #namagraduan #panjang https://t.co/dKU4jNe5b5","1844347151779860496","https://pbs.twimg.com/ext_tw_video_thumb/1844320158413979648/pu/img/dsiFy3FQVXwBI9XJ.jpg","","in","","0","0","0","https://x.com/sinarbestarimy/status/1844347151779860496","4711228398","sinarbestarimy"
"1844336929757856195","Thu Oct 10 11:19:24 +0000 2024","0","Postingan baru! 10 Oktober Hari Olahraga Taman Kanak-Kanak Apakah ada acara olahraga sekolah di negara Anda? https://t.co/J69cmggN82 -online-homestay/ Saya menantikan komentar baik Anda! #Jepang #onlinehomestay #anak-anak #olahraga #pendidikan https://t.co/jVg8NV4FBj","1844336929757856195","https://pbs.twimg.com/media/GZhmpyKb0AA_CMv.jpg","","in","Japan","0","0","0","https://x.com/online_homestay/status/1844336929757856195","1832959445397323776","online_homestay"
"1844327333358075988","Thu Oct 10 10:41:16 +0000 2024","3","Kementerian PUPR Gelar Seminar Kolaborasi dengan SAPPK ITB Wujudkan Kota Cerdas dan Berkelanjutan Selengkapnya: https://t.co/4ufkfVBCDP #ITBnews #Seminar #SmartLiving #Multidisiplin #pendidikan #TransformasiITB","1844327333358075988","","","in","Bandung - Jatinangor - Cirebon","0","0","1","https://x.com/itbofficial/status/1844327333358075988","22878447","itbofficial"
"1844327012288299130","Thu Oct 10 10:40:00 +0000 2024","0","Pesan JK ke Prabowo: Pilih Menteri Pendidikan yang Kuasai Bidangnya #beritanasional #kamis #Jokowi #pendidikan #prabowogibran https://t.co/meRenpOeZh","1844327012288299130","","","in","","0","0","0","https://x.com/NasionalBerita_/status/1844327012288299130","1769451991124832257","NasionalBerita_"
"1844326667965337712","Thu Oct 10 10:38:38 +0000 2024","0","@kemenPU Gelar Seminar Kolaborasi dengan SAPPK ITB Wujudkan Kota Cerdas dan Berkelanjutan Selengkapnya: https://t.co/4ufkfVBCDP #ITBnews #Seminar #SmartLiving #Multidisiplin #pendidikan #TransformasiITB","1844326667965337712","","KemenPU","in","Bandung - Jatinangor - Cirebon","0","0","0","https://x.com/itbofficial/status/1844326667965337712","22878447","itbofficial"
"1844313998063436212","Thu Oct 10 09:48:17 +0000 2024","0","Seramai 44 orang murid Sekolah Kebangsaan Seri Taman Kluang Barat Kluang Johor datang ke Karangkraf sebagai destinasi lawatan mereka pada hari ini. Jemput datang lagi ya adik-adik! #sinarbestari #pendidikan #karangkraf #buku #sekolahrendah #lawatan #kluang #johor https://t.co/k1acxCcZ9N","1844313998063436212","https://pbs.twimg.com/media/GZhRzUzasAAaGcC.jpg","","in","","0","0","0","https://x.com/sinarbestarimy/status/1844313998063436212","4711228398","sinarbestarimy"
"1844304141109318106","Thu Oct 10 09:09:07 +0000 2024","0","UMPSA kekal universiti teknikal nombor satu terbaik negara https://t.co/iC0EhQFrFH #BERITA #NASIONAL #PENDIDIKAN #ArtikelPercuma","1844304141109318106","","","in","Malaysia","0","0","0","https://x.com/UMonline/status/1844304141109318106","42199532","UMonline"
"1844288385651028273","Thu Oct 10 08:06:31 +0000 2024","5","Ramainya yang datang solat jenazah tiga pelajar UiTM Dungun ini. Mesti mereka sentiasa berbuat baik dengan semua orang. https://t.co/JVjGjDeUGj #sinarbestari #pendidikan #uitmdungun","1844288385651028273","","","in","","0","0","1","https://x.com/sinarbestarimy/status/1844288385651028273","4711228398","sinarbestarimy"
"1844288162270674996","Thu Oct 10 08:05:37 +0000 2024","0","Menteri Pendidikan Tinggi muat naik hantaran tentang bentuk bantuan yang akan disalurkan kepada keluarga mangsa kemalangan. Terima kasih Datuk Seri. https://t.co/28t7QGTs2W #sinarbestari #pendidikan #kpt #pelajaruitmdungun","1844288162270674996","","","in","","0","0","0","https://x.com/sinarbestarimy/status/1844288162270674996","4711228398","sinarbestarimy"
"1844286752556552327","Thu Oct 10 08:00:01 +0000 2024","0","Kita yang tengok sama-sama terkejut sekali pelajar-pelajar UUM mesti dah selalu jumpa lotong kan? Kredit: s4rohh #sinarbestari #pendidikan #UUM #lotong #terkejut #universiti #utara #mahasiswi #kpm #fyp https://t.co/YMiWAEv5l0","1844286752556552327","https://pbs.twimg.com/ext_tw_video_thumb/1844277560580112385/pu/img/7SwQ4lh9qNXVOlDb.jpg","","in","","0","0","0","https://x.com/sinarbestarimy/status/1844286752556552327","4711228398","sinarbestarimy"
"1844256900076142731","Thu Oct 10 06:01:24 +0000 2024","0","Ini Cara Cek Hasil UKPPPG Tahap 1 Periode 2 Tahun 2024 Sudah Siap? #Pendidikan #Guru https://t.co/TX2Lu9Enr6","1844256900076142731","","","in","Kota Depok, Jawa Barat","0","0","0","https://x.com/portalinfomase/status/1844256900076142731","1531670208217116673","portalinfomase"
"1844251389838622978","Thu Oct 10 05:39:30 +0000 2024","0","Kunjungan PPID @its_campus: Berbagi Pengalaman dalam Pengelolaan Informasi Publik Selengkapnya: https://t.co/lFvcs2cuUt #ITBnews #PPID #Informasi #Multidisiplin #pendidikan #TransformasiITB","1844251389838622978","","","in","Bandung - Jatinangor - Cirebon","0","0","0","https://x.com/itbofficial/status/1844251389838622978","22878447","itbofficial"
"1844249355387273385","Thu Oct 10 05:31:25 +0000 2024","1","Seminar Riset ITB dan Hiroshima University Bahas Dampak Transportation Super App bagi Perubahan Perilaku Masyarakat Selengkapnya: https://t.co/l8YGd59L1X #ITBnews #Seminar #Riset #Multidisiplin #pendidikan #TransformasiITB","1844249355387273385","","","in","Bandung - Jatinangor - Cirebon","2","0","0","https://x.com/itbofficial/status/1844249355387273385","22878447","itbofficial"
"1844247032455942246","Thu Oct 10 05:22:17 +0000 2024","0","6/ ‍ SDM yang Berkualitas Kualitas SDM Indonesia terutama di daerah masih rendah. Peningkatan kualitas pendidikan dan pelatihan kerja yang sesuai dengan kebutuhan industri sangat diperlukan. #Pendidikan #SDMBerkualitas","1844247056208232776","","COREIndonesia","in","Jakarta Capital Region, Indone","0","1","0","https://x.com/COREIndonesia/status/1844247056208232776","2783746813","COREIndonesia"
"1844246100842332169","Thu Oct 10 05:18:29 +0000 2024","1","Kuliah Tamu PWK ITB Bahas Transformasi Kawasan Jabar Bagian Selatan: Wujudkan Pembangunan Berkelanjutan untuk Masa Depan Selengkapnya: https://t.co/jHXLgIl5VH #ITBnews #KuliahTamu #Transformasi #Multidisiplin #pendidikan #TransformasiITB","1844246100842332169","","","in","Bandung - Jatinangor - Cirebon","0","0","0","https://x.com/itbofficial/status/1844246100842332169","22878447","itbofficial"
"1844240828786774087","Thu Oct 10 04:57:32 +0000 2024","29","Salam takziah untuk keluarga mangsa. Semoga segala urusan mereka dipermudahkan. #sinarbestari #Pendidikan #pelajaruitm #uitmdungun https://t.co/0KnGpkU7il","1844240828786774087","https://pbs.twimg.com/media/GZgPG2daAAEgwFP.jpg","","in","","2","1","5","https://x.com/sinarbestarimy/status/1844240828786774087","4711228398","sinarbestarimy"
