"conversation_id_str","created_at","favorite_count","full_text","id_str","image_url","in_reply_to_screen_name","lang","location","quote_count","reply_count","retweet_count","tweet_url","user_id_str","username"
"1848711624171131205","Tue Oct 22 13:02:53 +0000 2024","3","Membanggakan Pengembangan Inovasi SMPN 6 Mewakili Sampang ke Jawa Timur https://t.co/Ij7Z4yJ5wk #Sampang #Jatim #Pendidikan #Inovasi #SMPN6","1848711624171131205","","","in","Jawa Timur, Indonesia","0","0","3","https://x.com/sigap88news1/status/1848711624171131205","919102923916787713","sigap88news1"
"1848709487856914451","Tue Oct 22 12:54:23 +0000 2024","0","guys jadi aku lagi ada tugas buat penelitian mengenai kualitas pendidikan di Indonesia boleh minta bantuannya buat isi surveynya buat melengkapi data jurnalnya satu data dari kalian akan bermanfaat banget bagi aku https://t.co/ReDnUfjD0J #pendidikan #soshum #penelitian","1848709487856914451","","","in","","0","1","1","https://x.com/park_jayyseong/status/1848709487856914451","1835160764426207233","park_jayyseong"
"1848708020106051616","Tue Oct 22 12:48:33 +0000 2024","0","Judi Online: Faktor Penghambat Kemajuan Indeks SDM di Indonesia https://t.co/nc11favEzp #JudiOnline #IndeksSDM #KemajuanIndonesia #IPM #GenerasiMuda #Produktivitas #EkonomiIndonesia #KecanduanJudi #Pendidikan #Kemiskinan https://t.co/2zIiqUCdU3","1848708020106051616","https://pbs.twimg.com/media/GafuIs-WoAAjiqZ.jpg","","in","indonesia","0","0","0","https://x.com/Noelasalim/status/1848708020106051616","1658795961127411713","Noelasalim"
"1848707292436566391","Tue Oct 22 12:45:40 +0000 2024","3","Ketika orang tua murid yang juga polisi lebih fokus lapor guru ketimbang mendidik anak kita mungkin perlu mempertanyakan siapa sebenarnya yang mengemban tugas pendidikan. #Pendidikan #Etika #PecatAipdaWibowoHasyim","1848707292436566391","","","in","Kota Serang, Banten","0","0","0","https://x.com/AstCreator/status/1848707292436566391","1782764967109771264","AstCreator"
"1848695810667778198","Tue Oct 22 12:00:03 +0000 2024","0","Kepetahan adik Raisya turut disamakan dengan watak Sheldon dari 'Young Sheldon'. Kredit: raihanaannurhanna #sinarbestari #pendidikan #fyp #pidato #bahasainggeris #sheldon #youngsheldon https://t.co/P32mRvXkMM","1848695810667778198","https://pbs.twimg.com/ext_tw_video_thumb/1848665916911034368/pu/img/2KP56xgMcACe-5_2.jpg","","in","","0","0","0","https://x.com/sinarbestarimy/status/1848695810667778198","4711228398","sinarbestarimy"
"1848691725440848089","Tue Oct 22 11:43:49 +0000 2024","0","Pentingnya Asuransi Pendidikan untuk Masa Depan Anak #asuransi #insurance #pendidikan #AsuransiPendidikan #Anak #AnakSMP #indon https://t.co/tCmSmzaDSq","1848691725440848089","","","in","Dunia Maya","0","0","0","https://x.com/Si_jupo/status/1848691725440848089","4753049240","Si_jupo"
"1848676909619552333","Tue Oct 22 10:44:56 +0000 2024","101","PTPTN | Pemansuhan hutang Perbadanan Tabung Pendidikan Tinggi Nasional (PTPTN) sukar dilaksanakan berikutan kerajaan ketika ini mempunyai komitmen kewangan yang besar. #BuletinTV3 #PTPTN #pendidikan #mansuhPTPTN https://t.co/NKBHwh3TH7","1848676909619552333","https://pbs.twimg.com/media/GafR1eOXEAAMqiA.jpg","","in","Sri Pentas, Bandar Utama","11","67","30","https://x.com/BuletinTV3/status/1848676909619552333","155432431","BuletinTV3"
"1848658051890614663","Tue Oct 22 09:30:00 +0000 2024","2","Agung Danarto Dorong Univ Muhammadiyah Unggul Mahasiswa dan Akreditasinya https://t.co/WU1O5DLrOB #perguruantinggi #muhammadiyah #pendidikan","1848658051890614663","","","in","Indonesia","0","1","0","https://x.com/muhammadiyah/status/1848658051890614663","73309923","muhammadiyah"
"1848655504454873287","Tue Oct 22 09:19:53 +0000 2024","0","Ketua Komite III DPD RI Filep Wamafma meminta agar masalah Supriyani guru honorer di Konawe Selatan diungkap secara transparan ke publik agar tidak menimbulkan persepsi negatif pada guru. Dan juga Supriyani harus diperlakukan secara adil. #dpdri #komiteIII #guru #pendidikan https://t.co/LkKOwYKLN6","1848655504454873287","https://pbs.twimg.com/media/Gae-YW6bEAAFjk4.jpg","","in","Senayan - Jakarta - Indonesia","0","3","0","https://x.com/DPDRI/status/1848655504454873287","977870468","DPDRI"
"1848652675220746469","Tue Oct 22 09:08:38 +0000 2024","17","Kiai Saad Ibrahim Dorong Santri Muhammadiyah Angkat Wibawa NKRI di Kancah Internasional https://t.co/EUTaLaK2Zz #pendidikan #santri #muhammadiyah","1848652675220746469","","","in","Indonesia","0","0","5","https://x.com/muhammadiyah/status/1848652675220746469","73309923","muhammadiyah"
"1848642952400097701","Tue Oct 22 08:30:00 +0000 2024","10","UM Palangkaraya Resmi Miliki Program Studi Kedokteran https://t.co/T1ycPd1F5i #kedokteran #pendidikan #muhammadiyah","1848642952400097701","","","in","Indonesia","0","0","0","https://x.com/muhammadiyah/status/1848642952400097701","73309923","muhammadiyah"
"1848640385536467168","Tue Oct 22 08:19:48 +0000 2024","4","Orasi Ilmiah Guru Besar ITB Prof. Dr.rer.nat. Apt. Sophi Damayanti: Inovasi Polimer Tercetak Molekul untuk Analisis Mutu Obat Selengkapnya: https://t.co/Cjmq1omj4k #ITBnews #OrasiIlmiah #Obat #Multidisiplin #pendidikan #TransformasiITB","1848640385536467168","","","in","Bandung - Jatinangor - Cirebon","0","0","0","https://x.com/itbofficial/status/1848640385536467168","22878447","itbofficial"
"1848621176236740629","Tue Oct 22 07:03:28 +0000 2024","0","Transformasi pendidikan di Tangerang Selatan! SMPN 23 kini memiliki fasilitas baru yang mendorong semangat belajar siswa. . Yuk dukung upaya Pemkot Tangsel untuk pendidikan berkualitas! #Pendidikan #Tangsel #Banten #SMPN23 #update #news #seketika https://t.co/nxS4QMWWbo","1848621176236740629","","","in","Jakarta","0","0","0","https://x.com/seketikanet/status/1848621176236740629","1696426676065038336","seketikanet"
"1848617160035512385","Tue Oct 22 06:47:31 +0000 2024","0","Premier Sarawak Tan Sri Abang Johari Openg menyatakan bahawa negeri Sarawak komited untuk meningkatkan akses kepada pendidikan dan penjagaan kesihatan ... https://t.co/iU3tJy047X #sarawak #pendidikan #kesiatan #AbangJohari #mediatelus","1848617160035512385","","","in","","0","0","0","https://x.com/Media_telus/status/1848617160035512385","1828340505610199042","Media_telus"
"1848616526879904217","Tue Oct 22 06:45:00 +0000 2024","21","Mandiri Namun Tak Menutup Diri Cara Muhammadiyah Memajukan Pendidikan Indonesia https://t.co/SdLF2fbGK0 #muhammadiyah #pendidikan","1848616526879904217","","","in","Indonesia","0","0","4","https://x.com/muhammadiyah/status/1848616526879904217","73309923","muhammadiyah"
"1848616009886011639","Tue Oct 22 06:42:57 +0000 2024","0","Special Friends mari pelajari Bahasa Jawa warisan budaya dari Jawa Tengah! #specialearn #specialearneducation #specialeducation #bimbinganbelajar #bimbel #pendidikan #sekolah #bahasajawa #muatanlokal #kurikulummerdeka https://t.co/xYSGGbYNi7","1848616009886011639","https://pbs.twimg.com/ext_tw_video_thumb/1848615687369199618/pu/img/gtsErG67FwTD6R0p.jpg","","in","Jakarta Timur","0","0","0","https://x.com/specialearn/status/1848616009886011639","1835703503886671872","specialearn"
"1848612906017140744","Tue Oct 22 06:30:37 +0000 2024","19","Muhammadiyah Berencana Buka Kampus di Kamboja https://t.co/iJmWwSQQtx #pendidikan #muhammadiyah","1848612906017140744","","","in","Indonesia","1","0","2","https://x.com/muhammadiyah/status/1848612906017140744","73309923","muhammadiyah"
"1848609171761205534","Tue Oct 22 06:15:46 +0000 2024","1","Assalamualaikum #sahabatreligi Selasa 22 Oktober 2024 - Peringatan Hari Santri Nasional 2024 yang diselenggarakan di MUQ. Part2 #kanwil #kemenag #kemenagri #kemenagaceh #kemenagpidie #aceh #pidie #santri #pesantren #nasional #madrasah #quran #upacara #dinas #pendidikan #dayah https://t.co/wGgY77qAKu","1848609171761205534","https://pbs.twimg.com/media/GaeUO-abEAA73nM.jpg","","in","","0","0","0","https://x.com/Kemenagpidie/status/1848609171761205534","1807964860833320960","Kemenagpidie"
"1848608809125826591","Tue Oct 22 06:14:20 +0000 2024","1","Assalamualaikum #sahabatreligi Selasa 22 Oktober 2024 - Peringatan Hari Santri Nasional 2024 yang diselenggarakan di MUQ. Part1 #kanwil #kemenag #kemenagri #kemenagaceh #kemenagpidie #aceh #pidie #santri #pesantren #nasional #madrasah #quran #upacara #dinas #pendidikan #dayah https://t.co/CLzvAkXfQr","1848608809125826591","https://pbs.twimg.com/media/GaeT5RYbAAA8S1e.jpg","","in","","0","0","0","https://x.com/Kemenagpidie/status/1848608809125826591","1807964860833320960","Kemenagpidie"
"1848598634830659874","Tue Oct 22 05:33:54 +0000 2024","5","Muhammadiyah Realisasikan Dua Keinginan Kiai Dahlan dalam Satu Institusi Pendidikan https://t.co/bVPmAK9qKC #pendidikan #muhammadiyah","1848598634830659874","","","in","Indonesia","0","0","1","https://x.com/muhammadiyah/status/1848598634830659874","73309923","muhammadiyah"
"1848593927311684072","Tue Oct 22 05:15:12 +0000 2024","2","Orasi Ilmiah Prof. Novriana Sumarti: Optimisasi Keuangan Melalui Pemodelan Matematika Selengkapnya: https://t.co/uskLA8Xq1u #ITBnews #OrasiIlmiah #Matematika #Multidisiplin #pendidikan #TransformasiITB","1848593927311684072","","","in","Bandung - Jatinangor - Cirebon","0","0","0","https://x.com/itbofficial/status/1848593927311684072","22878447","itbofficial"
"1848591731962613923","Tue Oct 22 05:06:28 +0000 2024","1","Selamat Hari Santri 2024 🇮🇩🇮🇩🇮🇩 Semoga para santri dapat terus membuktikan diri menjadi pilar kebangsaan dan menjaga Pancasila Santri solih dan solihah Indonesia Berkah #santri #harisantri #pesantren #pondokpesantren #sekolah #pendidikan #TVRIJateng #mediapemersatubangsa https://t.co/hWPYH0Ueh5","1848591731962613923","https://pbs.twimg.com/media/GaeEYeWbEAE-2iZ.jpg","","in","Pucanggading Raya","0","0","0","https://x.com/tvrijateng/status/1848591731962613923","1085408062545018882","tvrijateng"
"1848589009804796405","Tue Oct 22 04:55:39 +0000 2024","0","Semoga di hari jadi yang ke-29 ini PT PLN Nusantara Power semakin maju semakin dilimpahi keberkahan dan semakin bermanfaat untuk masyarakat luas. Aamiin ya Rabbal Alamiin. #ProgramNurulHayat #Pendidikan #YatimDhuafa #NurulHayat #plnnusantarapower","1848589009804796405","","","in","Indonesia","0","0","0","https://x.com/nurulhayatku/status/1848589009804796405","1155803196","nurulhayatku"
"1848583582383804523","Tue Oct 22 04:34:05 +0000 2024","0","UTM-Atom Malaysia perkasa usaha arusperdanakan tenaga atom https://t.co/KgyPflCmS5 #BERITA #NASIONAL #PENDIDIKAN","1848583582383804523","","","in","Malaysia","0","0","1","https://x.com/UMonline/status/1848583582383804523","42199532","UMonline"
"1848580504523837682","Tue Oct 22 04:21:51 +0000 2024","0","Angkat Topik Infrastruktur Pesisir Tropis FTSL ITB Gelar TROCOZ Summer Course Program 2024 Selengkapnya: https://t.co/z47RPakkbP #ITBnews #summercourse #Multidisiplin #pendidikan #TransformasiITB","1848580504523837682","","","in","Bandung - Jatinangor - Cirebon","0","0","0","https://x.com/itbofficial/status/1848580504523837682","22878447","itbofficial"
"1848575008433746031","Tue Oct 22 04:00:01 +0000 2024","206","Muhammadiyah Salurkan Bantuan kepada 1.000 Guru Honorer https://t.co/voWs305ikn #Muhammadiyah #Guru #Pendidikan","1848575008433746031","","","in","Indonesia","1","6","61","https://x.com/muhammadiyah/status/1848575008433746031","73309923","muhammadiyah"
"1848572389506052411","Tue Oct 22 03:49:37 +0000 2024","0","Debat Perdana Pilwali Denpasar: ABDI Tawarkan Solusi Penanganan Sampah dan Pendidikan 𝘽𝙖𝙘𝙖 𝙎𝙚𝙡𝙚𝙣𝙜𝙠𝙖𝙥𝙣𝙮𝙖 𝙢𝙚𝙡𝙖𝙡𝙪𝙞 𝙇𝙞𝙣𝙠 : https://t.co/moB94JBfPa #pendidikan #sampah #debat #denpasar #abdi #koranbaliexpress #jawapos https://t.co/kVXfvTHZI8","1848572389506052411","https://pbs.twimg.com/media/Gadyx1TbEAEpYfx.jpg","","in","Denpasar, Bali","0","0","0","https://x.com/baliexpressnews/status/1848572389506052411","4844627833","baliexpressnews"
"1848564108142252287","Tue Oct 22 03:16:42 +0000 2024","7","AGUNG WIDYANTORO MINTA PEMERINTAHAN PRABOWO-GIBRAN KONSISTEN DALAM TERAPKAN KURIKULUM PENDIDIKAN #partaigolkar #golkarindonesia #golkarpedia #bahlillahadalia #agungwidyantoro #pendidikan https://t.co/2zmx6VeoHJ","1848564108142252287","https://pbs.twimg.com/ext_tw_video_thumb/1848563927891988480/pu/img/guWCPTciXorMhYNZ.jpg","","in","DKI Jakarta, Indonesia","0","0","41","https://x.com/golkarpedia/status/1848564108142252287","721898354502930433","golkarpedia"
"1848562668376105341","Tue Oct 22 03:10:59 +0000 2024","1","Perkembangan Pembangunan Gedung Rekayasa Molekuler dan Material Fungsional di ITB Selengkapnya: https://t.co/MMJllsqmtz #ITBnews #Molekuler #Material #Multidisiplin #pendidikan #TransformasiITB","1848562668376105341","","","in","Bandung - Jatinangor - Cirebon","0","0","0","https://x.com/itbofficial/status/1848562668376105341","22878447","itbofficial"
"1848558881787842982","Tue Oct 22 02:55:56 +0000 2024","0","PPDB Tahun Ajaran 2025-2026 Sekolah Katolik Santo Kristoforus KB/TK - SD - SMP - SMA masih membuka untuk Gelombang I dengan diskon 30% masih sampai tgl 31 Oktober 2024. Salam Kristoforus! #kristoforus #sekolahkatolik #jakartabarat #pendaftaransekolah #pendidikan #sekolah #PPDB https://t.co/OQRT7prCU9","1848558881787842982","https://pbs.twimg.com/ext_tw_video_thumb/1848558268844785664/pu/img/hkG5FaQkRvF9CNfs.jpg","","in","","0","0","0","https://x.com/schkristoforus/status/1848558881787842982","1825801913654456322","schkristoforus"
"1848545197841637636","Tue Oct 22 02:01:34 +0000 2024","0"," Hal ini memberikan pendedahan dan peluang kepada mereka untuk mengaplikasikan pelbagai pengetahuan dan kemahiran terutamanya dalam aspek komunikasi dan keusahawanan. https://t.co/x67zVqDV1i #sinarbestari #pendidikan #SMKKotaKemuning","1848545197841637636","","","in","","0","0","0","https://x.com/sinarbestarimy/status/1848545197841637636","4711228398","sinarbestarimy"
"1848545056380080620","Tue Oct 22 02:01:00 +0000 2024","0","Waduhh waktu sd belajar apaan nih di sekolahnya?? Harus dipertanyakan dan dicari tahu faktornya nih. Gimana tanggapan kalian? Komen di bawah ya! #iddbserbaserbi #murid #pendidikan #kemendikbud https://t.co/CbUlYfByvS","1848545056380080620","https://pbs.twimg.com/ext_tw_video_thumb/1848515743744430080/pu/img/U_J90bjS9vAkam5B.jpg","","in","","0","0","0","https://x.com/iddbid/status/1848545056380080620","1817158581386686465","iddbid"
"1848545039489925172","Tue Oct 22 02:00:56 +0000 2024","1","Anugerah Malaysia Teacher Prize 2024 milik Cikgu Velerie. Ramai pendidik termasuk Menteri Pendidikan akui segala kerja buat guru muda ini memang luar biasa. https://t.co/gxw8ia2yRz #sinarbestari #pendidikan #MTP2024","1848545039489925172","","","in","","0","0","0","https://x.com/sinarbestarimy/status/1848545039489925172","4711228398","sinarbestarimy"
"1848544924519575649","Tue Oct 22 02:00:28 +0000 2024","0","Mengoptimalkan Pembelajaran Interaktif dengan Magic Write #PembelajaranInteraktif #MagicWrite #RencanaPelajaran #Kreativitas #InovasiPendidikan #EngagementSiswa #MetodePembelajaran #IdeKreatif #TransformasiPembelajaran #Pendidikan https://t.co/3dPiYef9wJ","1848544924519575649","https://pbs.twimg.com/amplify_video_thumb/1848544854483009536/img/wlt5Ja8tHuySkvcN.jpg","","in","","0","0","0","https://x.com/kbcimb/status/1848544924519575649","131435423","kbcimb"
"1848544791229038678","Tue Oct 22 01:59:57 +0000 2024","0","Inisiatif bertujuan meningkatkan kemahiran dan kelayakan pendidik di peringkat tempatan dan antarabangsa. https://t.co/Oe0lKzCDnl #sinarbestari #pendidikan #tayloruniversity","1848544791229038678","","","in","","0","0","0","https://x.com/sinarbestarimy/status/1848544791229038678","4711228398","sinarbestarimy"
"1848544278185972124","Tue Oct 22 01:57:54 +0000 2024","0","Personalisasi pembelajaran dengan AI menciptakan pengalaman belajar yang adaptif efektif dan inklusif. Siapkan diri untuk revolusi pendidikan digital. https://t.co/e7mTKYsDvm #pendidikan #ai #personalisasi #teknologi #inklusif #pembelajaran","1848544278185972124","","","in","Semarang Indonesia","0","0","0","https://x.com/dartoiwan/status/1848544278185972124","195616521","dartoiwan"
"1848541666078298185","Tue Oct 22 01:47:32 +0000 2024","0","Pramono Anung Akan Benahi Masalah Pendidikan di Jakarta Calon gubernur Jakarta no 3 Pramono Anung memastikan membenahi program dan fasilitas pendidikan di Jakarta jika dirinya terpilih menjadi gubernur periode 2024-2029. #insightkita #JakartaMenyala #pramonoanung #pendidikan https://t.co/nW4BnEIiHy","1848541666078298185","https://pbs.twimg.com/ext_tw_video_thumb/1848541512067645440/pu/img/KnSKZw24GXsZmDBO.jpg","","in","","0","0","0","https://x.com/InsightKita/status/1848541666078298185","1847171629438455810","InsightKita"
"1848539771099832483","Tue Oct 22 01:40:00 +0000 2024","2","Profil Menteri Luar Negeri Sugiono: Pernah Cicipi Pendidikan Militer #beritanasional #selasa #MenteriLuarNegeri #Sugiono #Pendidikan #Militer https://t.co/bbExDeWaP6","1848539771099832483","","","in","","0","0","0","https://x.com/NasionalBerita_/status/1848539771099832483","1769451991124832257","NasionalBerita_"
"1848533272143581541","Tue Oct 22 01:14:10 +0000 2024","3","Pakar ITB Soroti Kebijakan Penggunaan QRIS untuk Atasi Parkir Liar Kota Bandung Selengkapnya: https://t.co/jHbNnal7Xf #ITBnews #research #Parkir #Multidisiplin #pendidikan #TransformasiITB","1848533272143581541","","","in","Bandung - Jatinangor - Cirebon","1","0","0","https://x.com/itbofficial/status/1848533272143581541","22878447","itbofficial"
"1848503111192875308","Mon Oct 21 23:14:20 +0000 2024","0","Butiran: https://t.co/ZvoIV0yVOz #kemboja #ratanakiri #wakaf #sahamakhirat #pendidikan #asnaf #DakwahDanKemanusiaan #MISI7 BANTU KAMI SEBARKAN... ","1848503113638154453","","VMisi7","in","Shah Alam, Selangor","0","0","0","https://x.com/VMisi7/status/1848503113638154453","4793401045","VMisi7"
"1848403688135823565","Mon Oct 21 16:39:15 +0000 2024","1","Mengapa Guru Perlu Membaca Capaian Pembelajaran Sebelum Melaksanakan Pembelajaran? #pendidikan https://t.co/YSnwZzI33M","1848403688135823565","","","in","","0","0","0","https://x.com/VartikelCom/status/1848403688135823565","1686587079416020992","VartikelCom"
"1848378681431044382","Mon Oct 21 14:59:55 +0000 2024","0","Saksikan live di YouTube channel Warga Silungkang pada hari Selasa malam 29 Okt 2024 pukul 19:30-20:30WIB. #NgobrolTontangSilungkang #NgotaSilungkang #pendidikan #efektifbelajar #efisienbelajar #generasimudaSilungkang #WargaSilungkang #Silungkang #Sawahlunto #syahrialsyarif","1848378691329597849","","wargasilungkang","in","Jakarta Capital Region, Indone","0","0","0","https://x.com/wargasilungkang/status/1848378691329597849","1604894162029252608","wargasilungkang"
"1848362578713690348","Mon Oct 21 13:55:54 +0000 2024","1","Sertijab Mendikdasmen dari Nadiem Ini Pesannya https://t.co/gxIkywbcvm #indoposco #Kemendikdasmen #KementerianPendidikan #Mendikdasmen #pendidikan #ProfAbdulMuti","1848362578713690348","","","in","DKI Jakarta","0","0","0","https://x.com/indoposco/status/1848362578713690348","1349713962472861696","indoposco"
"1848348523441332602","Mon Oct 21 13:00:03 +0000 2024","0","Terharu tengok kasih sayang antara cikgu dengan anak-anak muridnya. Kredit: nelyhuu #sinarbestari #pendidikan #kpm #internship #hariterakhir #fyp https://t.co/o46I2oNdVC","1848348523441332602","https://pbs.twimg.com/ext_tw_video_thumb/1848301893975736320/pu/img/djdJcV5hr_jHYXFX.jpg","","in","","0","0","0","https://x.com/sinarbestarimy/status/1848348523441332602","4711228398","sinarbestarimy"
"1848342759591346419","Mon Oct 21 12:37:09 +0000 2024","0","Dinas Pendidikan Pemuda dan Olahraga (Disdikpora) Kabupaten Buleleng mengadakan rapat verifikasi dan validasi data Anak Tidak Sekolah (ATS) yang terdaftar pada dasbor Data Induk Pendidikan Kementerian. #DisdikporaBuleleng #AnakTidakSekolah #Pendidikan https://t.co/xfHpwnzcOq","1848342759591346419","","","in","Bali","0","0","0","https://x.com/updatebalii/status/1848342759591346419","1293295315148140545","updatebalii"
"1848338390246432832","Mon Oct 21 12:19:47 +0000 2024","0","Halo sahabat #pendidikan Main bulutangkis terasa asyik bila bersama kawan kawan Tetapi kalau mainin perasaan seseorang apakah itu asyik? #pendidikannonformal #pendidikankesetaraan https://t.co/xshXd3lbeP","1848338390246432832","https://pbs.twimg.com/ext_tw_video_thumb/1848338341663805440/pu/img/LaNIPKTS2iL4ko45.jpg","","in","Kota Balikpapan","0","0","0","https://x.com/SkbTengah/status/1848338390246432832","1526803165987094529","SkbTengah"
"1848337851609760079","Mon Oct 21 12:17:38 +0000 2024","0","Halo sahabat #pendidikan Yuk intip keseruan kami saat melakukan jalan sehat mengelilingi sekitar SKB Balikpapan Tengah kalau jalan sehat membuat badan sehat kalau hubungan jalan ditempat gimana ya #pendidikannonformal #pendidikankesetaraan https://t.co/LLrU9YWqVb","1848337851609760079","https://pbs.twimg.com/ext_tw_video_thumb/1848337762271047680/pu/img/sZvpuzMCaMnJRFbE.jpg","","in","Kota Balikpapan","0","0","0","https://x.com/SkbTengah/status/1848337851609760079","1526803165987094529","SkbTengah"
"1848337103761076278","Mon Oct 21 12:14:40 +0000 2024","0","Halo sahabat #pendidikan SKB Balikpapan Tengah telah berpartisipasi dalam kegiatan Puncak Peringatan Hari Aksara Internasional 2024 di BSCC Dome Balikpapan Yuk intip dokumentasi kami ya #pendidikannonformal https://t.co/HCmNok9fl3","1848337103761076278","","","in","Kota Balikpapan","0","0","0","https://x.com/SkbTengah/status/1848337103761076278","1526803165987094529","SkbTengah"
"1848316261580894454","Mon Oct 21 10:51:51 +0000 2024","0","Memorandum of Understanding (MoU) antara BPRS HIK Parahyangan dan STAI Darussalam Kunir Subang. #MoU #PerbankanSyariah #STAI #HIKParahyangan #Kerjasama #BPRS #FinansialSyariah #Pendidikan https://t.co/9o9PBVtv29","1848316261580894454","https://pbs.twimg.com/media/GaaJ0ANaEAAHAvX.jpg","","in","Jl. Percobaan No.38B, Cileunyi","0","0","0","https://x.com/bprshikp/status/1848316261580894454","1451092365251264518","bprshikp"
"1848310054044528680","Mon Oct 21 10:27:11 +0000 2024","0","Belanjawan 2025: Biasiswa ke universiti peluang pendidikan dan latihan TVET https://t.co/n8JnJoM2l6 #Pendidikan #AnwarIbrahim #belanjawan #belanjwan2025 #featured","1848310054044528680","","","in","Petaling Jaya","0","0","0","https://x.com/relevan_com_my/status/1848310054044528680","1466280226183282692","relevan_com_my"
"1848308893627375898","Mon Oct 21 10:22:34 +0000 2024","0","Belanjawan 2025: Baik pulih prasarana serta penguasaan literasi dan numerasi https://t.co/j3JenyXNnw #Pendidikan #AnwarIbrahim #belanjawan #Belanjawan2025 #featured","1848308893627375898","","","in","Petaling Jaya","0","0","0","https://x.com/relevan_com_my/status/1848308893627375898","1466280226183282692","relevan_com_my"
"1848308833250390515","Mon Oct 21 10:22:20 +0000 2024","1","YKMI berkesempatan melakukan silaturrahim ke BPMP (Balai Penjaminan Mutu Pendidikan) Provinsi Aceh untuk membahas kolaborasi dalam Program Penguatan Kualitas Pendidikan di Aceh Besar. #pendidikan #aceh #acehbesar #kolaborasi #bpmp #bpmpaceh #YKMI https://t.co/yL6Am1T4fB","1848308833250390515","https://pbs.twimg.com/media/GaaDCkJbAAAHV41.jpg","","in","Indonesia","0","0","1","https://x.com/OfficialYKMI/status/1848308833250390515","357377321","OfficialYKMI"
"1848308609752735965","Mon Oct 21 10:21:28 +0000 2024","2","Selamat dan sukses atas pelantikan Prof. Dr. Ir. Satryo Soemantri Brodjonegoro sebagai Menteri Pendidikan Tinggi Sains dan Teknologi #menteri #pendidikan #sains #teknologi #merah #putih #pendidikantinggi #indonesia https://t.co/92iUO9fdBg","1848308614932611398","https://pbs.twimg.com/media/GaaBrsub0AAp24r.jpg","youngdinamis","in","Jakarta Capital Region","0","0","1","https://x.com/youngdinamis/status/1848308614932611398","841149503939915777","youngdinamis"
"1848300696040313155","Mon Oct 21 09:50:00 +0000 2024","1","Profil Abdul Mu'ti Menteri Pendidikan Dasar dan Menengah Era Prabowo #beritanasional #senin #PrabowoGibran #Pendidikan https://t.co/jIM4ZP1WhS","1848300696040313155","","","in","","0","0","0","https://x.com/NasionalBerita_/status/1848300696040313155","1769451991124832257","NasionalBerita_"
"1848294830583288031","Mon Oct 21 09:26:41 +0000 2024","0","Mesti seronok adik-adik nak belajar tak cepat rasa mengantuk. Kredit: cigurazz #sinarbestari #pendidikan #simulasi #kapalterbang #prasekolah #fyp https://t.co/TTzsrBYwVc","1848294830583288031","https://pbs.twimg.com/ext_tw_video_thumb/1848294704158535680/pu/img/rvdC7vVwH2vA6o96.jpg","","in","","0","0","0","https://x.com/sinarbestarimy/status/1848294830583288031","4711228398","sinarbestarimy"
"1848290748057235500","Mon Oct 21 09:10:28 +0000 2024","0","#Pendidikan STAI Nusantara Banda Aceh dan UIN Ar-Raniry Tingkatkan Kualitas Pendidikan dan Pengajaran PAI https://t.co/hXAjwzzT3B via @tribunnews","1848290748057235500","","","in","Aceh","0","0","0","https://x.com/serambinews/status/1848290748057235500","64635651","serambinews"
"1848287564182298708","Mon Oct 21 08:57:49 +0000 2024","5","Kampus Geologi Lukulo Karangsambung: Kawasan Alam Terpadu untuk Riset Geologi Selengkapnya: https://t.co/TQsUgvbEcL #ITBnews #Geologi #Karangsambung #Multidisiplin #pendidikan #TransformasiITB","1848287564182298708","","","in","Bandung - Jatinangor - Cirebon","1","0","2","https://x.com/itbofficial/status/1848287564182298708","22878447","itbofficial"
"1848280543336800556","Mon Oct 21 08:29:55 +0000 2024","2","Mendikdasmen Prof Abdul Mu ti: Majukan Pendidikan dengan Gagasan Baru https://t.co/hmpdYaywCY #Mendikdasmen #pendidikan #ProfAbdulMuti","1848280543336800556","","","in","DKI Jakarta","0","0","1","https://x.com/indopos_id/status/1848280543336800556","1197403547681218560","indopos_id"
