"conversation_id_str","created_at","favorite_count","full_text","id_str","image_url","in_reply_to_screen_name","lang","location","quote_count","reply_count","retweet_count","tweet_url","user_id_str","username"
"1851104170834612521","Tue Oct 29 03:30:00 +0000 2024","0","Magang Merdeka terus lanjut tapi perlu dibenahi! Apa pendapat kalian? #MagangMerdeka #Pendidikan #Kemendikbud #Magang https://t.co/xVS9anyzNJ","1851104170834612521","","","in","Palmerah, Indonesia","0","0","0","https://x.com/diswayid/status/1851104170834612521","1527499111163138050","diswayid"
"1851100952637677782","Tue Oct 29 03:17:13 +0000 2024","0","Selamat &amp; Sukses Ibu Rina Widyastuti S.Pd. Guru PKWU SMA Negeri 1 Simo telah lulus melaksanakan Program Pendidikan Guru Penggerak Angkatan 10. Semoga ilmu yg diperoleh selama Pendidikan Guru Penggerak dapat bermanfaat. #guru #gurupenggerak #cgp #pendidikan #kemdikbud https://t.co/6ZSjFkKsgf","1851100952637677782","https://pbs.twimg.com/media/GbBugF3bMAA2fA4.jpg","","in","Jawa Tengah, Indonesia","0","0","0","https://x.com/sman1simo/status/1851100952637677782","1821053900411330560","sman1simo"
"1851099080036168052","Tue Oct 29 03:09:47 +0000 2024","0","Selamat &amp; Sukses Ibu Sri Wahyuni M.Pd. Guru Matematika SMA Negeri 1 Simo telah lulus melaksanakan Program Pendidikan Guru Penggerak Angkatan 10. Semoga ilmu yg diperoleh selama Pendidikan Guru Penggerak dapat bermanfaat. #guru #gurupenggerak #cgp #pendidikan #kemdikbud https://t.co/F1mVWYXdaj","1851099080036168052","https://pbs.twimg.com/media/GbBszJvbQAIpa01.jpg","","in","Jawa Tengah, Indonesia","0","0","0","https://x.com/sman1simo/status/1851099080036168052","1821053900411330560","sman1simo"
"1851097766451392672","Tue Oct 29 03:04:33 +0000 2024","0","Bedah Visi Misi Cawalkot Tarakan Khairul: Pelayanan Dasar Pendidikan dan Kesehatan Masih Prioritas #CalonWaliKota #JuataPermai #Pilkada #PilkadaTarakan #Pendidikan #Kesehatan #Tarakan #KalimantanUtara #Kaltara https://t.co/DHrU5nMIeU via @tribunnews","1851097766451392672","","","in","Tanjung Selor","0","0","0","https://x.com/KaltaraTribun/status/1851097766451392672","1689503322070470656","KaltaraTribun"
"1851096488245608468","Tue Oct 29 02:59:29 +0000 2024","0","Ayo teman-teman kelas 6 ramaikan lomba Bulan Bahasa 6 SMP Kesatuan Bogor! Direkomendasikan juga lho oleh Dinas Pendidikan Kota Bogor. https://t.co/kADrgAPVNM #smpkesatuan #smp #bogor #pendidikan #education #lomba #bulanbahasa #kelas6 #sekolahdasar #dinaspendidikan #kotabogor","1851096488245608468","","","in","Kota Bogor, Jawa Barat","0","0","0","https://x.com/smpkesatuanbgr/status/1851096488245608468","1811288741618892800","smpkesatuanbgr"
"1851090063880569069","Tue Oct 29 02:33:57 +0000 2024","0","Penculikan Anak Kecil ketauan warga pelaku lakukan Penyekapan! TNI Polisi Warga bantu #indonesia #viral #mobil #polisi #berita #fyp #karawang #subang #purwakarta #jakarta #bandung #news #lucu #bus #sekolah #pendidikan #wanita #muslimah #muslim #quote https://t.co/CuJmbbpQym","1851090063880569069","https://pbs.twimg.com/ext_tw_video_thumb/1851088725956268032/pu/img/2Rm-aRHaEGK6vggL.jpg","","in","Indonesia","0","0","0","https://x.com/MediainID/status/1851090063880569069","1709840210329276416","MediainID"
"1851079003567702049","Tue Oct 29 01:50:00 +0000 2024","0","New Post: HUT ke 29 SMA Muhammadiyah Toboali Gelar Penggalangan Dana https://t.co/jGCoORuQTw #smamuhamadiyahtoboali #smamuhammadiyah #pendidikan","1851079003567702049","","","in","Sungai Liat, Indonesia","0","0","0","https://x.com/intrikdotid/status/1851079003567702049","1382918965366714371","intrikdotid"
"1851060850389619002","Tue Oct 29 00:37:52 +0000 2024","0","Overdosis AI di kalangan siswa dan mahasiswa hancurkan kemampuan olah pikir dan kreatifitas. Bagaimana siswa atau anak kita? Sudah overdosis? https://t.co/lbQYN9gcfL #pendidikan #teknologi #kecerdasan #etika #inovasi #kreativitas","1851060850389619002","","","in","Semarang Indonesia","0","0","0","https://x.com/dartoiwan/status/1851060850389619002","195616521","dartoiwan"
"1851055693870297469","Tue Oct 29 00:17:23 +0000 2024","1","Pesan Rektor di Wisuda Oktober 2024: Tanggung Jawab Baru Wisudawan ITB di Era Modern Selengkapnya: https://t.co/aYQg5usMvg #ITBnews #wisokto #wisuda #Multidisiplin #pendidikan #TransformasiITB","1851055693870297469","","","in","Bandung - Jatinangor - Cirebon","0","1","1","https://x.com/itbofficial/status/1851055693870297469","22878447","itbofficial"
"1851034999690350727","Mon Oct 28 22:55:09 +0000 2024","0","KEMPEN DANA SUMBANGAN WAKAF VAN SEKOLAH PELAJAR ASNAF DI KUDAT SABAH 🇲🇾 ️Kemaskini: 26-10-2024 ️Terkumpul: RM1 613/RM47 000 Butiran: https://t.co/VK0zzw7rwv #sabah #kudat #wakaf #sahamakhirat #pendidikan #asnaf #MISI7 https://t.co/vMboxYhIrv","1851034999690350727","https://pbs.twimg.com/media/GbAyg0laQAAxJ7S.jpg","","in","Shah Alam, Selangor","0","0","0","https://x.com/VMisi7/status/1851034999690350727","4793401045","VMisi7"
"1850978455636361717","Mon Oct 28 19:10:27 +0000 2024","0","semoga kita semua dalam kondisi sehat juga bahagia. bagi seluruh rakyat #indonesia sudah tidak punya hutang lagi. tercukupi semua kebutuhan sehari hari. #pendidikan sudah dipenuhi #negara","1850978455636361717","","","in","50187 Jateng","0","0","0","https://x.com/moc_salim/status/1850978455636361717","731894529289113600","moc_salim"
"1850877251409371273","Mon Oct 28 12:28:19 +0000 2024","7","MWA ITB Tetapkan 10 Bakal Calon Rektor ITB 2025-2030 Selengkapnya: https://t.co/oFXY96w9nm #ITBnews #PilRek2025 #Rektor #Multidisiplin #pendidikan #TransformasiITB","1850877251409371273","","","in","Bandung - Jatinangor - Cirebon","9","1","1","https://x.com/itbofficial/status/1850877251409371273","22878447","itbofficial"
"1850870141040423191","Mon Oct 28 12:00:03 +0000 2024","1","Belut sudah serupa ular. Takut! Kredit: zuraidajamaludin #sinarbestari #pendidikan #skptd #harisukantara #belut #cikgu #lucu https://t.co/RsBGMA8RI2","1850870141040423191","https://pbs.twimg.com/ext_tw_video_thumb/1850818413436002304/pu/img/0lQUPQBa5QnamAJZ.jpg","","in","","0","0","0","https://x.com/sinarbestarimy/status/1850870141040423191","4711228398","sinarbestarimy"
"1850855026878480735","Mon Oct 28 11:00:00 +0000 2024","0","Ramai di media sosial seorang guru sedang mengetes siswanya untuk menjawab soal satuan waktu. Salah satu soalnya adalah 1 jam sama dengan berapa menit tetapi siswa tersebut tidak bisa menjawab dengan benar. #Pendidikan #MedcomId #MudamemberiArti https://t.co/J9pAbCPRcP","1850855026878480735","","","in","Jakarta Capital Region, Indone","0","0","0","https://x.com/medcom_id/status/1850855026878480735","902837643024539651","medcom_id"
"1850824357909872728","Mon Oct 28 08:58:08 +0000 2024","0","Bahaya ketergantungan AI di kalangan siswa dan mahasiswa penting untuk kita pikirkan bersama. Mengapa? Siapa yang mungkin terkena dampak buruknya? Kita atau juga anak-anak kita? https://t.co/lbQYN9gcfL #pendidikan #teknologi #kecerdasan #etika #inovasi #kreativitas","1850824357909872728","","","in","Semarang Indonesia","0","0","0","https://x.com/dartoiwan/status/1850824357909872728","195616521","dartoiwan"
"1850819936693686659","Mon Oct 28 08:40:34 +0000 2024","0","Hadis biar dijaga Allah #hadits #hadis #bahasaarab #guru #semangat #pendidikan https://t.co/yf1WQ1EGZE","1850819936693686659","https://pbs.twimg.com/ext_tw_video_thumb/1850819873288704000/pu/img/8cPtvXySbOJ14z1i.jpg","","in","Yogyakarta, Indonesia","0","0","0","https://x.com/Ahadi_Official/status/1850819936693686659","1833752150964670464","Ahadi_Official"
"1850817885226336755","Mon Oct 28 08:32:25 +0000 2024","9","3 siswa di Banten dipulangkan oleh pihak sekolah karena tak mampu bayar SPP. #banten #pendidikan #sekolah https://t.co/q8hQrGgsMo","1850817885226336755","https://pbs.twimg.com/ext_tw_video_thumb/1850817842717102080/pu/img/AVtjJ4vWEZIxAbGr.jpg","","in","NKRI","2","4","4","https://x.com/antaranews/status/1850817885226336755","18071520","antaranews"
"1850803136719692125","Mon Oct 28 07:33:48 +0000 2024","0","#Pendidikan Dr Hamdani M Syam Terpilih sebagai Ketua Ikatan Alumni Universiti Kebangsaan Malaysia Wilayah Aceh https://t.co/ALuilFMusf via @tribunnews","1850803136719692125","","","in","Aceh","0","0","0","https://x.com/serambinews/status/1850803136719692125","64635651","serambinews"
"1850802179487273196","Mon Oct 28 07:30:00 +0000 2024","0","Menteri Pendidikan Tinggi Sains dan Teknologi (Mendiktisaintek) Satryo Soemantri Brodjonegoro memastikan program magang merdeka akan dilanjutkan. #Pendidikan #MedcomId #MudaMemberiArti https://t.co/WY6aPHgVCQ","1850802179487273196","","","in","Jakarta Capital Region, Indone","0","0","0","https://x.com/medcom_id/status/1850802179487273196","902837643024539651","medcom_id"
"1850798403816394815","Mon Oct 28 07:15:00 +0000 2024","0","Menteri Pendidikan Dasar dan Menengah (Mendikdasmen) Abdul Mu'ti mengatakan penambahan gaji guru sebesar Rp2 juta masih dikaji. #Pendidikan #MedcomId #MudaMemberiArti https://t.co/WjpuEhhDng","1850798403816394815","","","in","Jakarta Capital Region, Indone","0","0","0","https://x.com/medcom_id/status/1850798403816394815","902837643024539651","medcom_id"
"1850794631233261703","Mon Oct 28 07:00:00 +0000 2024","0","Akhirnya Cikgu Din dapat duduk bersama isteri tercinta. Alhamdulillah! #sinarbestari #pendidikan #cikgudin #kelantan #sarawak #kanser #kpm https://t.co/aiKcQ0n1OL","1850794631233261703","https://pbs.twimg.com/media/Ga85rTxbwAAvHYr.jpg","","in","","0","1","0","https://x.com/sinarbestarimy/status/1850794631233261703","4711228398","sinarbestarimy"
"1850794629224088008","Mon Oct 28 07:00:00 +0000 2024","0","Menteri Pendidikan Dasar dan Menengah Abdul Mu'ti tak hanya akan memperkuat pendidikan matematika di jenjang Sekolah Dasar (SD). Penguatan juga pada bidang sains dan teknologi. #Pendidikan #MedcomId #MudaMemberiArti https://t.co/msDN0dTc4U","1850794629224088008","","","in","Jakarta Capital Region, Indone","0","0","0","https://x.com/medcom_id/status/1850794629224088008","902837643024539651","medcom_id"
"1850778387520114730","Mon Oct 28 05:56:02 +0000 2024","1","Pembahasan KUA-PPAS APBD tahun anggaran 2025 di lima Komisi DPRD DKI Jakarta dimulai sejak Rabu (23/10) sampai Jumat (25/10) kemarin. #Pembahasan #KUAPPAS #APBD2025 #Pendidikan #Kesehatan #Prioritas #DKIJakarta #Jakarta","1850778531984556402","","dprddkijakarta","in","Jakarta Pusat, DKI Jakarta","0","0","0","https://x.com/dprddkijakarta/status/1850778531984556402","4677002173","dprddkijakarta"
"1850776786151637438","Mon Oct 28 05:49:06 +0000 2024","0","Special Friends belajar Bahasa Inggris untuk era global! #specialearn #specialearneducation #specialeducation #bimbinganbelajar #bimbel #pendidikan #sekolah #bahasainggris #kurikulummerdeka #globalskills https://t.co/q9VBgiFx0A","1850776786151637438","https://pbs.twimg.com/ext_tw_video_thumb/1850776528487165952/pu/img/JcP7sRV_8HNGuwOP.jpg","","in","Jakarta Timur","0","0","0","https://x.com/specialearn/status/1850776786151637438","1835703503886671872","specialearn"
"1850772347965575514","Mon Oct 28 05:31:28 +0000 2024","0","Halo sahabat #pendidikan Penyelenggaraan ANBK Paket A Tahun 2024 di Lab Komputer dan CLC SKB Balikpapan Tengah dengan materi Literasi dan Survei Karakter #pendidikanindonesia #pendidikankesetaraan #ANBK https://t.co/k06vSrwymY","1850772347965575514","https://pbs.twimg.com/ext_tw_video_thumb/1850772301887029248/pu/img/mrwsNXgeY76xMuNs.jpg","","in","Kota Balikpapan","0","0","0","https://x.com/SkbTengah/status/1850772347965575514","1526803165987094529","SkbTengah"
"1850771404805066892","Mon Oct 28 05:27:43 +0000 2024","0","Halo sahabat #pendidikan Sebagai anak muda Indonesia yuk mengingat kembali perjuangan pahlawan Indonesia mengikrarkan Sumpah Pemuda. Indonesia satu tanah air satu bangsa satu bahasa 🇮🇩 #sumpahpemuda2024 #pendidikanindonesia #pendidikanindonesia https://t.co/R7ddOcW26y","1850771404805066892","https://pbs.twimg.com/ext_tw_video_thumb/1850771292775145472/pu/img/SdSG45ezI-3owaCN.jpg","","in","Kota Balikpapan","0","0","0","https://x.com/SkbTengah/status/1850771404805066892","1526803165987094529","SkbTengah"
"1850764908620828730","Mon Oct 28 05:01:56 +0000 2024","0","Dalam sambutannya Betty Malia mengucapkan terima kasih kepada Kalapas Urip Dharma Yoga atas kesempatan yang diberikan kepada mahasiswa. Kegiatan ini membuka wawasan mereka terhadap aspek sosial &amp; psikologis di lapas. #Pendidikan #PsikologiSosial https://t.co/mmESuN5WGO","1850764916724306360","https://pbs.twimg.com/media/Ga88ze7bMAAwGPT.jpg","lapaskediri","in","Kediri, Surabaya, Jatim","0","1","0","https://x.com/lapaskediri/status/1850764916724306360","1567683313661517825","lapaskediri"
"1850760916587225343","Mon Oct 28 04:46:02 +0000 2024","0","Pemkab Jombang Anggarkan Pengadaan Peralatan TIK untuk SD di P-APBD 2024 #pendidikan #anggaranpendidikan #pengadaanperalatanTIK #APBDJombang #DisdikbudJombang @KabJombang https://t.co/iZVXqK3WYu","1850760916587225343","","","in","Jakarta Pusat, DKI Jakarta","0","0","0","https://x.com/BongkahI/status/1850760916587225343","1226400848080539650","BongkahI"
"1850760779492135371","Mon Oct 28 04:45:29 +0000 2024","1"," Penyelidikan dijalankan Institut Penyelidikan Khazanah pada 2018 menunjukkan 72 peratus keputusan anak-anak mengenai masa depan dipengaruhi ibu bapa mereka kata Timbalan Menteri Pendidikan Inovasi dan... #Pendidikan #Malaysia #themerdekatimes https://t.co/ic03M9x7lq","1850760779492135371","https://pbs.twimg.com/media/Ga85HvRa8AApSWd.jpg","","in","Kuala Lumpur City","0","1","0","https://x.com/TheMerdekaTimes/status/1850760779492135371","1539830140770758657","TheMerdekaTimes"
"1850756818089414667","Mon Oct 28 04:29:45 +0000 2024","0","Keseruan ITB Integrated Career Days 2024: Peluang Karier Terbuka Lebar untuk Semua Selengkapnya: https://t.co/4h2Ileng4S #ITBnews #ITBIntegratedCareerDays #Multidisiplin #pendidikan #TransformasiITB","1850756818089414667","","","in","Bandung - Jatinangor - Cirebon","0","1","0","https://x.com/itbofficial/status/1850756818089414667","22878447","itbofficial"
"1850756134703177803","Mon Oct 28 04:27:02 +0000 2024","0","Ini Tujuan Disdikbud Jombang Bekali Guru PAUD Pendidikan Inklusif #pendidikan #PAUD #pendidikannonformal #BimtekpendidikaninklusifPAUD #DisdikbudJombang https://t.co/HYfEuhYu0S","1850756134703177803","","","in","Jakarta Pusat, DKI Jakarta","0","0","0","https://x.com/BongkahI/status/1850756134703177803","1226400848080539650","BongkahI"
"1850737035218481642","Mon Oct 28 03:11:08 +0000 2024","0","Tak kisahlah anak siapa yang penting awak rajin berusaha dan dapat capai apa yang diimpikan. Tahniah dik! https://t.co/tLGqqu5Axw #sinarbestari #pendidikan #politeknik #politekniktuankusyedsirajuddin #anugerahdiraja","1850737035218481642","","","in","","0","0","0","https://x.com/sinarbestarimy/status/1850737035218481642","4711228398","sinarbestarimy"
"1850714825128870369","Mon Oct 28 01:42:53 +0000 2024","0","Program NILAM ini tidak hanya menekankan tabiat membaca sahaja malah melahirkan penulis-penulis muda yang berbakat dalam penulisan kreatif. https://t.co/WSmLWVlt2F #sinarbestari #pendidikan #NILAM","1850714825128870369","","","in","","0","0","0","https://x.com/sinarbestarimy/status/1850714825128870369","4711228398","sinarbestarimy"
"1850714537412223351","Mon Oct 28 01:41:44 +0000 2024","0","Tahniah dan syabas kepada semua graduan UMPSA yang telah berjaya menamatkan pengajian. https://t.co/2NuX2bLHf0 #sinarbestari #pendidikan #UMPSA","1850714537412223351","","","in","","0","0","0","https://x.com/sinarbestarimy/status/1850714537412223351","4711228398","sinarbestarimy"
"1850713676988518781","Mon Oct 28 01:38:19 +0000 2024","0","KPT umum cara Pengajaran dan Pembelajaran para pelajar serta tenaga pengajar beragama Hindu sempena Deepavali tidak lama lagi. https://t.co/nOiwzsP2yL #sinarbestari #pendidikan #KPT #deepavali #agamahindu","1850713676988518781","","","in","","0","0","0","https://x.com/sinarbestarimy/status/1850713676988518781","4711228398","sinarbestarimy"
"1850713508637483208","Mon Oct 28 01:37:39 +0000 2024","0","eGTukar mudahkan guru-guru pindah sekolah atas urusan tertentu. https://t.co/D73lYNY8vo #sinarbestari #pendidikan #egtukar","1850713508637483208","","","in","","0","0","0","https://x.com/sinarbestarimy/status/1850713508637483208","4711228398","sinarbestarimy"
"1850713331822411785","Mon Oct 28 01:36:57 +0000 2024","0"," Kalau ikut perancangan awal adalah pertengahan tahun hadapan tetapi terdapat keperluan untuk dilaksanakan lebih awal kata Timbalan Menteri Pertahanan Adly Zahari. https://t.co/VJL7Ixnznr #sinarbestari #pendidikan #PLKN","1850713331822411785","","","in","","0","0","0","https://x.com/sinarbestarimy/status/1850713331822411785","4711228398","sinarbestarimy"
"1850683902316454166","Sun Oct 27 23:40:01 +0000 2024","0","#kongsirezeki #sahamakhirat #pendidikan #asnaf #ratanakiri #kemboja #MISI7 BANTU KAMI SEBARKAN...","1850683904531050878","","VMisi7","in","Shah Alam, Selangor","0","0","0","https://x.com/VMisi7/status/1850683904531050878","4793401045","VMisi7"
"1850596964133724331","Sun Oct 27 18:01:19 +0000 2024","0","@nadiemmakarim @gojekindonesia Karena ulah anda anak Belum siap lulus di luluskan #pendidikan #yasalam","1850598668371628242","","TXTDRDIGITALID","in","S.E.ASIA","0","0","0","https://x.com/TXTDRDIGITALID/status/1850598668371628242","1826300760147329031","TXTDRDIGITALID"
"1850590172502716423","Sun Oct 27 17:27:34 +0000 2024","0","@nadiemmakarim hadeh anda Bukan Berfikir malah ketawa Dan senyum senyum garagra Anda Pelajar jadi GBLK seperti anda tau kagak !!! anda lapat malah senyum anda garagra Kurikulum ganti ganti Dan tidak bener #pagiTwitter #pendidikan #pelajar #kurikulum #nadiemmakariem","1850590172502716423","","nadiemmakarim","in","S.E.ASIA","0","1","0","https://x.com/TXTDRDIGITALID/status/1850590172502716423","1826300760147329031","TXTDRDIGITALID"
"1850558040648597566","Sun Oct 27 15:19:53 +0000 2024","0","Menjelang peringatan #sumpahpemuda kembali merenungkan pilar #pendidikan https://t.co/C1yItp0n2h","1850558040648597566","https://pbs.twimg.com/media/Ga6AusLbQAAq7tg.jpg","","in","","0","0","0","https://x.com/bioZvers/status/1850558040648597566","1434185199907082243","bioZvers"
"1850517092849827905","Sun Oct 27 12:37:10 +0000 2024","0","Hadis yang ngebahas jaga ucapan #hadits #hadis #bahasaarab #guru #semangat #pendidikan https://t.co/HkPxJmSwlg","1850517092849827905","https://pbs.twimg.com/ext_tw_video_thumb/1850517042644094976/pu/img/iLAaW_4KGruPe0rr.jpg","","in","Yogyakarta, Indonesia","0","0","0","https://x.com/Ahadi_Official/status/1850517092849827905","1833752150964670464","Ahadi_Official"
"1850513831581417863","Sun Oct 27 12:24:12 +0000 2024","1","Pakar saraf OKU terima anugerah khas TVETec Malaysia https://t.co/m4H7nRhws7 #BERITA #PENDIDIKAN #TERKINI","1850513831581417863","","","in","Malaysia","0","0","0","https://x.com/UMonline/status/1850513831581417863","42199532","UMonline"
"1850507929218064826","Sun Oct 27 12:00:45 +0000 2024","0","Kabupaten Buleleng kini memiliki total 503 orang guru penggerak yang siap berperan sebagai agen perubahan dalam dunia pendidikan. #Buleleng #Pendidikan #Guru https://t.co/4bYsU1sy4C","1850507929218064826","","","in","Bali","0","0","0","https://x.com/updatebalii/status/1850507929218064826","1293295315148140545","updatebalii"
"1850500998696948104","Sun Oct 27 11:33:13 +0000 2024","0","Berikut adalah jadwal materi SpeciaLearn pada 28 Oktober-3 November 2024. #specialearn #specialearneducation #specialeducation #bimbinganbelajar #bimbel #pendidikan #disabilitas #cacat #sekolah https://t.co/w0hADWndCq","1850500998696948104","https://pbs.twimg.com/media/Ga5Mq6JaoAALmkM.jpg","","in","Jakarta Timur","0","0","0","https://x.com/specialearn/status/1850500998696948104","1835703503886671872","specialearn"
"1850449355867832456","Sun Oct 27 08:08:00 +0000 2024","0","Special Friends ekspresikan kreativitasmu dalam Seni Budaya! #specialearn #specialearneducation #specialeducation #bimbinganbelajar #bimbel #pendidikan #sekolah #senibudaya #kreativitas #kurikulummerdeka https://t.co/e5kobRtLAn","1850449355867832456","https://pbs.twimg.com/ext_tw_video_thumb/1850449047796228096/pu/img/xEEdOEmruGGIWJpV.jpg","","in","Jakarta Timur","0","0","0","https://x.com/specialearn/status/1850449355867832456","1835703503886671872","specialearn"
"1850446099234095287","Sun Oct 27 07:55:04 +0000 2024","0","Miris! 3 Siswa SD di Pandeglang Dipulangkan Paksa Pihak Sekolah Gegara Tak Mampu Bayar SPP Baca di sini: https://t.co/j9S6b9ORS9 #Siswa #UangSPP #Pendidikan #SekolahDasar #Pandeglang #Biaya #InfoTerkini #Viral https://t.co/cfLIguRIgo","1850446099234095287","https://pbs.twimg.com/media/Ga4a6UhbAAEJCjB.jpg","","in","","0","0","0","https://x.com/finindonesia/status/1850446099234095287","998801336601788417","finindonesia"
"1850442994778071361","Sun Oct 27 07:42:44 +0000 2024","0","Bayangkan kelas tanpa guru! AI kini memimpin pembelajaran. Apakah ini masa depan pendidikan? https://t.co/AbctlUjr69 #pendidikan #guru #ai #inovasi #belajar #motivator Titip share untuk para guru","1850442994778071361","","","in","Semarang Indonesia","0","0","0","https://x.com/dartoiwan/status/1850442994778071361","195616521","dartoiwan"
"1850397467994636666","Sun Oct 27 04:41:49 +0000 2024","2","Viral Narasi Kembalikan NEM hingga Syarat Tidak Naik Kelas Mendikdasmen Abdul Mu'ti Buka Suara https://t.co/3EMjTFforX #RadarJabar #Pendidikan #Sekolah #NEM #TidakNaikKelas #AbdulMuti #KabinetMerahPutih","1850397467994636666","","","in","Jawa Barat","0","0","0","https://x.com/radarjabar_id/status/1850397467994636666","1651883208404000769","radarjabar_id"
"1850200952399356392","Sat Oct 26 15:40:56 +0000 2024","0","siapa yang bisa kamu tersenyum? barang kali #Negara juga #bangsa semoga periode ini semua #rakyat bahagia. #miskin #bodah #kurang #pendidikan tidak peduli.... karena kamu sudah #hidup.","1850200952399356392","","","in","50187 Jateng","0","0","0","https://x.com/moc_salim/status/1850200952399356392","731894529289113600","moc_salim"
"1850190161365401673","Sat Oct 26 14:58:03 +0000 2024","0","Cikgu Din akan ditempatkan di sekolah berhampiran supaya dia dapat melaksanakan tugasan dan juga bersama dengan isterinya. - Fadhlina https://t.co/ooGgHbzxiF #sinarbestari #pendidikan #gurudukalara","1850190161365401673","","","in","","0","0","0","https://x.com/sinarbestarimy/status/1850190161365401673","4711228398","sinarbestarimy"
"1850189903407280635","Sat Oct 26 14:57:02 +0000 2024","0","'Perjalanan ini bukanlah tanpa cabaran tetapi menyambung pengajian ACCA adalah satu anugerah.' https://t.co/nZDoHdHtsz #ACCAExams #ACCA #sinarbestari #pendidikan","1850189903407280635","","","in","","0","0","0","https://x.com/sinarbestarimy/status/1850189903407280635","4711228398","sinarbestarimy"
"1850139710532018602","Sat Oct 26 11:37:35 +0000 2024","0","Semua perlu berwaspada. Cakna dengan perubahan cuaca! #sinarbestari #metmalaysia #pendidikan https://t.co/R0fTVpw4ff","1850139710532018602","https://pbs.twimg.com/media/Ga0EQcgaYAAOSRw.jpg","","in","","0","0","0","https://x.com/sinarbestarimy/status/1850139710532018602","4711228398","sinarbestarimy"
"1850106868087357537","Sat Oct 26 09:27:05 +0000 2024","0","Di blik serunya di magelang ada sesuatu yang tidak terexpos miris seorang murid di pulangkan dari sekolah karena tidak bisa membayar uang ujian. #pendidikan https://t.co/r9VUAeQBf2","1850106868087357537","https://pbs.twimg.com/ext_tw_video_thumb/1850003431307821056/pu/img/GVwWMq4XeuVZs55u.jpg","","in","Jakarta Timur, DKI Jakarta","0","0","0","https://x.com/Roesmana01/status/1850106868087357537","245302989","Roesmana01"
"1850106773174403236","Sat Oct 26 09:26:42 +0000 2024","0","Special Friends mari pahami nilai-nilai dasar bangsa dengan Pendidikan Pancasila! #specialearn #specialearneducation #specialeducation #bimbinganbelajar #bimbel #pendidikan #sekolah #pancasila #kurikulummerdeka https://t.co/XAaYpSk2ad","1850106773174403236","https://pbs.twimg.com/ext_tw_video_thumb/1850106551102767104/pu/img/eFV9n2BNOfYk07kG.jpg","","in","Jakarta Timur","0","0","0","https://x.com/specialearn/status/1850106773174403236","1835703503886671872","specialearn"
"1850076660202352690","Sat Oct 26 07:27:03 +0000 2024","4","ITB Gelar Wisuda Pertama Tahun Akademik 2024/2025 Selengkapnya: https://t.co/Da7NLhrEdP #ITBnews #Wisuda #wisokto #Multidisiplin #pendidikan #TransformasiITB","1850076660202352690","","","in","Bandung - Jatinangor - Cirebon","0","0","0","https://x.com/itbofficial/status/1850076660202352690","22878447","itbofficial"
"1850057907427213623","Sat Oct 26 06:12:32 +0000 2024","0","Pemerintahan Presiden Prabowo menegaskan komitmen dalam memperkuat pendidikan sains teknologi dan digitalisasi sebagai fondasi kemandirian bangsa. #Prabowo #PresidenPrabowo #Pendidikan #SainsdanTeknologi #Digitalisasi https://t.co/Zm9ZMqiIZ2","1850057907427213623","https://pbs.twimg.com/ext_tw_video_thumb/1850057662945452032/pu/img/kvVDqQ5wCjXjYxjJ.jpg","","in","","0","0","0","https://x.com/PrawakaZ/status/1850057907427213623","1509572781515866115","PrawakaZ"
"1850057627763605879","Sat Oct 26 06:11:25 +0000 2024","0","Pemerintahan Presiden Prabowo menegaskan komitmen dalam memperkuat pendidikan sains teknologi dan digitalisasi sebagai fondasi kemandirian bangsa. #Prabowo #PresidenPrabowo #Pendidikan #SainsdanTeknologi #Digitalisasi https://t.co/4L9C6hm8ml","1850057627763605879","https://pbs.twimg.com/media/Gay5lpMawAAKJfU.jpg","","in","","0","0","0","https://x.com/PrawakaZ/status/1850057627763605879","1509572781515866115","PrawakaZ"
